{"schemaVersion":"1.6.0","feedbackSchemaVersion":"1.6.0","distributionVersion":"1.6.0-curator.1","workbenchReleaseId":"ohri-mouse-interneuron-public-data-workbench-1.6.0","maximumFileBytes":2097152,"maximumFeedbackRecords":10,"minimumIndependentCuratorsForComparison":2,"privacy":"Created locally; not uploaded.","requiredResponseKeys":["curator_id","expertise","review_date","zip_verified","zip_sha256","us01","us02","us03","us04","us05","us06","status_interpretation","registration_concern","representativeness_concern","overall_verdict","overall_notes","attestation"],"optionalResponseKeys":["us01_notes","us02_notes","us03_notes","us04_notes","us05_notes","us06_notes","evidence_issues","wording_corrections","rights_registration_issues"]}
